{
  "schema_version": "optimization-request.v1",
  "optimization_id": "opt-001",
  "ruleset_version": "commander-2026-02-09",
  "command_zone": [
    "11111111-1111-4111-8111-111111111111"
  ],
  "partial_deck": [
    {
      "oracle_id": "22222222-2222-4222-8222-222222222222",
      "quantity": 1
    },
    {
      "oracle_id": "33333333-3333-4333-8333-333333333333",
      "quantity": 1
    }
  ],
  "optimizer_profile_id": "casual-core-v1",
  "constraints": {
    "must_include": [
      "22222222-2222-4222-8222-222222222222"
    ],
    "must_exclude": [
      "66666666-6666-4666-8666-666666666666"
    ],
    "collection_only": false,
    "land_count": {
      "min": 34,
      "max": 40
    },
    "role_bounds": {
      "card_draw": {
        "min": 8,
        "max": 15
      }
    }
  },
  "solver": {
    "random_seed": 1729,
    "num_workers": 1,
    "max_conflicts": 100000
  },
  "score_snapshot_id": "scores-001"
}
